{
  "generator": "c2r.synth v1",
  "patients": [
    {
      "chair_id": "C01",
      "clinically_fixed": false,
      "consent_to_move": false,
      "display_name": "Peoriosk Drarnlaen",
      "fixed_reason": null,
      "late_start_min": 0,
      "mobility": "assist",
      "moves_this_week": 0,
      "nurse_note": "S1 start 06:15, chair C01, 240 min. Needs a hand to transfer. Has not consented to schedule changes.",
      "patient_id": "P01",
      "recovery_buffer_min": 20,
      "rider_id": "R01",
      "runover_min": 0,
      "rx_days": "MWF",
      "rx_duration_min": 240,
      "shift_id": "S1",
      "start_time": "06:15"
    },
    {
      "chair_id": "C02",
      "clinically_fixed": true,
      "consent_to_move": true,
      "display_name": "Kinsaem Dioskslel",
      "fixed_reason": "nephrologist order for a fixed start",
      "late_start_min": 29,
      "mobility": "ambulatory",
      "moves_this_week": 0,
      "nurse_note": "S1 start 06:00, chair C02, 240 min. Walks on unaided. Start time clinically fixed: nephrologist order for a fixed start.",
      "patient_id": "P02",
      "recovery_buffer_min": 20,
      "rider_id": "R02",
      "runover_min": 13,
      "rx_days": "MWF",
      "rx_duration_min": 240,
      "shift_id": "S1",
      "start_time": "06:00"
    },
    {
      "chair_id": "C03",
      "clinically_fixed": false,
      "consent_to_move": true,
      "display_name": "Paskgu Ranbrond",
      "fixed_reason": null,
      "late_start_min": 0,
      "mobility": "wheelchair",
      "moves_this_week": 0,
      "nurse_note": "S1 start 06:30, chair C03, 240 min. Wheelchair.",
      "patient_id": "P03",
      "recovery_buffer_min": 20,
      "rider_id": "R03",
      "runover_min": 0,
      "rx_days": "MWF",
      "rx_duration_min": 240,
      "shift_id": "S1",
      "start_time": "06:30"
    },
    {
      "chair_id": "C04",
      "clinically_fixed": false,
      "consent_to_move": false,
      "display_name": "Soulshin Lyamgon",
      "fixed_reason": null,
      "late_start_min": 0,
      "mobility": "assist",
      "moves_this_week": 0,
      "nurse_note": "S1 start 06:00, chair C04, 210 min. Needs a hand to transfer. Has not consented to schedule changes.",
      "patient_id": "P04",
      "recovery_buffer_min": 20,
      "rider_id": "R04",
      "runover_min": 8,
      "rx_days": "MWF",
      "rx_duration_min": 210,
      "shift_id": "S1",
      "start_time": "06:00"
    },
    {
      "chair_id": "C05",
      "clinically_fixed": true,
      "consent_to_move": true,
      "display_name": "Pardiom Pronmeir",
      "fixed_reason": "post-session cardiac monitoring",
      "late_start_min": 0,
      "mobility": "ambulatory",
      "moves_this_week": 0,
      "nurse_note": "S1 start 06:15, chair C05, 240 min. Walks on unaided. Hypotension on previous sessions; extended recovery buffer. Start time clinically fixed: post-session cardiac monitoring.",
      "patient_id": "P05",
      "recovery_buffer_min": 35,
      "rider_id": null,
      "runover_min": 14,
      "rx_days": "MWF",
      "rx_duration_min": 240,
      "shift_id": "S1",
      "start_time": "06:15"
    },
    {
      "chair_id": "C06",
      "clinically_fixed": false,
      "consent_to_move": true,
      "display_name": "Lyasvyan Biareor",
      "fixed_reason": null,
      "late_start_min": 0,
      "mobility": "wheelchair",
      "moves_this_week": 0,
      "nurse_note": "S1 start 06:15, chair C06, 240 min. Wheelchair.",
      "patient_id": "P06",
      "recovery_buffer_min": 20,
      "rider_id": "R05",
      "runover_min": 4,
      "rx_days": "MWF",
      "rx_duration_min": 240,
      "shift_id": "S1",
      "start_time": "06:15"
    },
    {
      "chair_id": "C07",
      "clinically_fixed": false,
      "consent_to_move": true,
      "display_name": "Pirveor Drirkaen",
      "fixed_reason": null,
      "late_start_min": 0,
      "mobility": "ambulatory",
      "moves_this_week": 0,
      "nurse_note": "S1 start 06:00, chair C07, 225 min. Walks on unaided.",
      "patient_id": "P07",
      "recovery_buffer_min": 20,
      "rider_id": "R06",
      "runover_min": 0,
      "rx_days": "MWF",
      "rx_duration_min": 225,
      "shift_id": "S1",
      "start_time": "06:00"
    },
    {
      "chair_id": "C08",
      "clinically_fixed": false,
      "consent_to_move": true,
      "display_name": "Famtral Shondrith",
      "fixed_reason": null,
      "late_start_min": 10,
      "mobility": "ambulatory",
      "moves_this_week": 0,
      "nurse_note": "S1 start 06:15, chair C08, 240 min. Walks on unaided.",
      "patient_id": "P08",
      "recovery_buffer_min": 20,
      "rider_id": "R07",
      "runover_min": 0,
      "rx_days": "MWF",
      "rx_duration_min": 240,
      "shift_id": "S1",
      "start_time": "06:15"
    },
    {
      "chair_id": "C09",
      "clinically_fixed": false,
      "consent_to_move": true,
      "display_name": "Rorkael Biondtun",
      "fixed_reason": null,
      "late_start_min": 0,
      "mobility": "wheelchair",
      "moves_this_week": 0,
      "nurse_note": "S1 start 06:30, chair C09, 240 min. Wheelchair.",
      "patient_id": "P09",
      "recovery_buffer_min": 20,
      "rider_id": null,
      "runover_min": 0,
      "rx_days": "MWF",
      "rx_duration_min": 240,
      "shift_id": "S1",
      "start_time": "06:30"
    },
    {
      "chair_id": "C10",
      "clinically_fixed": false,
      "consent_to_move": false,
      "display_name": "Stisfen Biomrin",
      "fixed_reason": null,
      "late_start_min": 0,
      "mobility": "ambulatory",
      "moves_this_week": 0,
      "nurse_note": "S1 start 06:30, chair C10, 255 min. Walks on unaided. Has not consented to schedule changes.",
      "patient_id": "P10",
      "recovery_buffer_min": 20,
      "rider_id": "R08",
      "runover_min": 2,
      "rx_days": "MWF",
      "rx_duration_min": 255,
      "shift_id": "S1",
      "start_time": "06:30"
    },
    {
      "chair_id": "C11",
      "clinically_fixed": false,
      "consent_to_move": true,
      "display_name": "Rombraem Broldon",
      "fixed_reason": null,
      "late_start_min": 0,
      "mobility": "assist",
      "moves_this_week": 0,
      "nurse_note": "S1 start 06:30, chair C11, 225 min. Needs a hand to transfer.",
      "patient_id": "P11",
      "recovery_buffer_min": 20,
      "rider_id": null,
      "runover_min": 0,
      "rx_days": "MWF",
      "rx_duration_min": 225,
      "shift_id": "S1",
      "start_time": "06:30"
    },
    {
      "chair_id": "C12",
      "clinically_fixed": false,
      "consent_to_move": true,
      "display_name": "Slousteo Skeslo",
      "fixed_reason": null,
      "late_start_min": 0,
      "mobility": "wheelchair",
      "moves_this_week": 0,
      "nurse_note": "S1 start 06:00, chair C12, 255 min. Wheelchair. Hypotension on previous sessions; extended recovery buffer.",
      "patient_id": "P12",
      "recovery_buffer_min": 35,
      "rider_id": null,
      "runover_min": 17,
      "rx_days": "MWF",
      "rx_duration_min": 255,
      "shift_id": "S1",
      "start_time": "06:00"
    },
    {
      "chair_id": "C01",
      "clinically_fixed": true,
      "consent_to_move": true,
      "display_name": "Torgiath Draegroum",
      "fixed_reason": "nephrologist order for a fixed start",
      "late_start_min": 0,
      "mobility": "ambulatory",
      "moves_this_week": 0,
      "nurse_note": "S2 start 11:00, chair C01, 240 min. Walks on unaided. Start time clinically fixed: nephrologist order for a fixed start.",
      "patient_id": "P13",
      "recovery_buffer_min": 20,
      "rider_id": null,
      "runover_min": 25,
      "rx_days": "MWF",
      "rx_duration_min": 240,
      "shift_id": "S2",
      "start_time": "11:00"
    },
    {
      "chair_id": "C02",
      "clinically_fixed": false,
      "consent_to_move": true,
      "display_name": "Lothbrya Helslaem",
      "fixed_reason": null,
      "late_start_min": 0,
      "mobility": "ambulatory",
      "moves_this_week": 0,
      "nurse_note": "S2 start 10:45, chair C02, 225 min. Walks on unaided.",
      "patient_id": "P14",
      "recovery_buffer_min": 20,
      "rider_id": "R09",
      "runover_min": 0,
      "rx_days": "MWF",
      "rx_duration_min": 225,
      "shift_id": "S2",
      "start_time": "10:45"
    },
    {
      "chair_id": "C03",
      "clinically_fixed": false,
      "consent_to_move": true,
      "display_name": "Griolren Starndrum",
      "fixed_reason": null,
      "late_start_min": 0,
      "mobility": "ambulatory",
      "moves_this_week": 0,
      "nurse_note": "S2 start 11:15, chair C03, 240 min. Walks on unaided.",
      "patient_id": "P15",
      "recovery_buffer_min": 20,
      "rider_id": "R10",
      "runover_min": 0,
      "rx_days": "MWF",
      "rx_duration_min": 240,
      "shift_id": "S2",
      "start_time": "11:15"
    },
    {
      "chair_id": "C04",
      "clinically_fixed": false,
      "consent_to_move": true,
      "display_name": "Daskmyal Kreorhan",
      "fixed_reason": null,
      "late_start_min": 0,
      "mobility": "assist",
      "moves_this_week": 0,
      "nurse_note": "S2 start 10:45, chair C04, 225 min. Needs a hand to transfer.",
      "patient_id": "P16",
      "recovery_buffer_min": 20,
      "rider_id": "R11",
      "runover_min": 21,
      "rx_days": "MWF",
      "rx_duration_min": 225,
      "shift_id": "S2",
      "start_time": "10:45"
    },
    {
      "chair_id": "C05",
      "clinically_fixed": false,
      "consent_to_move": false,
      "display_name": "Sulziond Gondkond",
      "fixed_reason": null,
      "late_start_min": 0,
      "mobility": "wheelchair",
      "moves_this_week": 0,
      "nurse_note": "S2 start 11:00, chair C05, 210 min. Wheelchair. Has not consented to schedule changes.",
      "patient_id": "P17",
      "recovery_buffer_min": 20,
      "rider_id": "R12",
      "runover_min": 0,
      "rx_days": "MWF",
      "rx_duration_min": 210,
      "shift_id": "S2",
      "start_time": "11:00"
    },
    {